United States,"The Texas Tribune, ProPublica",Big,Texas Tribune Data Visuals Team Portfolio," Data journalism is a foundational practice and value at the Texas Tribune. A decade into our existence, data reporting was more important than ever. The coronavirus pandemic made access to accurate information a matter of public safety, and the Tribune’s data visuals team was uniquely prepared to cover the pandemic’s impacts. Our team’s 2020 portfolio shows how we leveraged our expertise in data reporting, analysis, design and presentation to make crucial information clear to Texans in acts of public service and accountability journalism.      The Tribune’s data visuals team in 2020 consisted of an editor, Darla Cameron; three developers, Chris Essig, Carla Astudillo and Mandi Cai; an investigative data reporter, Ren Larson; and fellow Anna Novak. Our work is supported by designer Emily Albracht and the Tribune’s editors, audience team and engineers. We work seamlessly together, and we strive to maintain an environment where the collaboration required to publish our most complex and demanding journalism is possible.    The best example of this collaboration is our coronavirus case tracker, which we take turns updating every day. The tracker is an example of what we do so well — gather complex data, distill it, and present it to readers in a way that they can understand. It’s also a daily accountability story, and the Tribune’s most viewed story of 2020. As Texas rolled back its restrictions and case totals surged multiple times, the tracker was a clear and consistent place for readers to understand how state leaders’ decisions impacted their personal safety.    Coronavirus data was just part of our work in 2020. In the spring, after years of planning and development, we reimagined a core Tribune product — our government salaries database — in a way that is both easier for readers to use and a better tool for accountability reporting. The Tribune launched a new investigative team with ProPublica, which uncovered the story of a company that was suing thousands of low-income Latino immigrants during the pandemic and stopped after we started asking questions. We investigated why Texas’ largest cities spend more on police than anything else in their budgets. The data visuals team built tools to help Texans learn how to cast their ballots safely in a state that opted not to expand voting by mail. We also published the most comprehensive election results in the state.    Our portfolio for the year reflects our organization’s dedication to presenting a full picture for readers, giving them the tools to be more thoughtful, productive and engaged citizens. In 2020, The Tribune’s mission was truly driven by data.   "," The Texas Tribune’s data visuals team submits the following projects in its portfolio:        <a href=""https://apps.texastribune.org/features/2020/texas-coronavirus-cases-map/"" style=""text-decoration:none;""><u>Texas coronavirus cases: Latest updates   The team’s biggest undertaking this year is our coronavirus case tracker, which we have updated every day starting in April. The Tribune’s coronavirus tracker is distinguished by its clear design and its focus on accountability. Throughout the pandemic, Texas’ state health agency repeatedly changed the way they report the data, and our team of journalists had to respond on the fly. This was the Tribune’s most-visited story of 2020, with 2.65 million page views from 834,000 users from April through December. Users spent more than more than three minutes on the page, which is more than double the average time spent on all other Tribune stories.       <a href=""https://apps.texastribune.org/features/2020/coronavirus-texas-cities-social-distancing-flatten-curve/"" style=""text-decoration:none;""><u>Coronavirus in Texas cities: See how social distancing could reduce stress on hospitals   Early in the pandemic, we explored what it would take for Texas to flatten the curve.       <a href=""https://apps.texastribune.org/features/2020/texas-unemployment/"" style=""text-decoration:none;""><u>Texas unemployment rate: How coronavirus is hitting the economy   The Tribune’s first economic data tracker explores Texas’ financial recovery.       <a href=""https://salaries.texastribune.org/"" style=""text-decoration:none;""><u>Government Salaries Explorer   We redesigned this database to be more useful for readers and reporters, with new visualizations and data over time.       <a href=""https://www.texastribune.org/2020/08/14/texas-police-budgets-austin-dallas-houston-san-antonio/"" style=""text-decoration:none;""><u>Texas’ largest cities spend more on police than anything else. Activists want more of those funds spent on the social safety net instead.   This analysis of the budgets of Texas’ four largest cities sets the stage for potential cuts in police funding.       <a href=""https://www.texastribune.org/2020/08/31/texas-oportun-lender-latinos/"" style=""text-decoration:none;""><u>This loan company was founded to help Latino immigrants. It has sued thousands of low-income Latinos during the pandemic.   A monthslong investigation revealed that Oportun Inc. uses lawsuits to intimidate a vulnerable population into keeping up with high-interest loan payments — even amid the pandemic.       <a href=""https://apps.texastribune.org/features/2020/texas-voting-2020/"" style=""text-decoration:none;""><u>Voting in Texas during the pandemic: Everything you need to know about the 2020 general election   Our voter guide allowed Texans to look up their ballot and find out how to safely vote in 2020.        <a href=""https://apps.texastribune.org/features/2020/texas-early-voting-numbers/"" style=""text-decoration:none;""><u>At least 9.7 million Texans — 57% of registered voters — voted early   We tracked turnout during Texas’ extended early voting period, and the data hinted at unusually high turnout in the state.       <a href=""https://apps.texastribune.org/features/2020/general-election-results/"" style=""text-decoration:none;""><u>Here are the Texas 2020 election results   Our election results page is designed to quickly show readers the results of the races they voted in.         <a href=""https://www.texastribune.org/2020/11/06/texas-trump-biden-counties-rural-suburban-city/"" style=""text-decoration:none;""><u>In Texas, Biden’s urban wins couldn’t offset Trump’s millions of votes in rural, red counties   We broke Texas into political regions to explore how the balance of voting power is subtly shifting in the state.     ",https://apps.texastribune.org/features/2020/texas-coronavirus-cases-map/,https://apps.texastribune.org/features/2020/coronavirus-texas-cities-social-distancing-flatten-curve/,https://apps.texastribune.org/features/2020/texas-unemployment/,https://salaries.texastribune.org/,https://www.texastribune.org/2020/08/14/texas-police-budgets-austin-dallas-houston-san-antonio/,https://www.texastribune.org/2020/08/31/texas-oportun-lender-latinos/,https://apps.texastribune.org/features/2020/texas-early-voting-numbers/,https://www.texastribune.org/2020/11/06/texas-trump-biden-counties-rural-suburban-city/,https://apps.texastribune.org/features/2020/texas-voting-2020/,https://apps.texastribune.org/features/2020/general-election-results/,,,,
Argentina,Data Journalism course (Social Sciences Department - National University of Avellaneda) -UNDAV-,Small,Datos UNDAV,"   Datos UNDAV  is the Data Journalism chair of the National University of Avellaneda -UNDAV- (Argentina), which functions as a space for teaching, learning, laboratory for experimentation and practice of data journalism for students.     Students' data journalism articles are at <a href=""http://datosundav.com.ar/"">datosundav.com.ar  (Link to automatic translation into English of the full site: <a href=""http://bit.ly/3rdWZNw"">http://bit.ly/3rdWZNw )    Since 2015, the UNDAV's Bachelor of Journalism includes within its study plan the subject Data Journalism. In this way, UNDAV became a pioneer in Latin America in the teaching of data journalism in an undergraduate degree and with a specific subject.   The main goal of Datos UNDAV is to provide conceptual frameworks and practical tools that allow thinking about and exercising data journalism.   Throughout the semester, students get the necessary skills for the production of journalistic pieces created from large databases and the creation of  interactive visualizations using digital tools available on the web. They will have the skills required to join the data journalism team of any professional newsroom.   The subject includes theoretical content and the use of digital tools for searching, processing and curating data, as well as for publishing and visualizing information. In addition, cases of good practices in data journalism in national media, the region and the rest of the world are studied. Also, it proposes that students know the process of requesting access to public information both national and local level.     I am Damián Profeta (@damianprofeta)  and the subject is in my charge. I have been practicing journalism for 15 years and I have been teaching at the university level for 10 years. In 2015 I was summoned to create the subject Data Journalism. Since then, 12 cohorts of students had the oportunity of learning the basics of data journalism and putting it into practice in a classroom-workshop-newsroom modality.   The Datos UNDAV experience was presented in the 8th. International Forum of Digital Journalism at the National University of Rosario (UNR) at the end of 2015: <a href=""http://bit.ly/3rk867B"">http://bit.ly/3rk867B    Likewise, the experience was reviewed in an article in the first digital book of the Meeting of Chairs of Investigative Journalism in Argentina ""In search of journalism that inquires into power."" 2016: <a href=""http://bit.ly/2NW2bqY"">http://bit.ly/2NW2bqY    Furthermore, the Datos UNDAV proposal was selected in the first order of merit as a research project to analyze and describe the practice of data journalism in Latin America. The work was a combination of research and journalistic practice with the students and was funded by the National University of Avellaneda - Call ""PIPP 2018"" carried out among 2019 y 2020: <a href=""http://bit.ly/2NZj04h"">http://bit.ly/2NZj04h    In 2019, the experience of the UNDAV in teaching data journalism as a unique case in public universities in Argentina with a specific subject in a university journalism career was highlighted in the investigation of the National University of Lomas de Zamora ( UNLZ) ""Public Universities that teach data journalism in Argentina: which ones, how and why"". Abstract in english: <a href=""https://bit.ly/3axr6sz"">https://bit.ly/3axr6sz    In 2019, also, I defended my master's thesis on teaching data journalism. It was evaluated as Outstanding by the San Andrés University (UdeSA). ","   DatosUNDAV.com.ar  includes   <a href=""http://bit.ly/2MUODLL"">24 articles on data journalism created in 2020  from public databases in Argentina  on issues of gender, The use of public funds, human trafficking, employment, economy, health, education, housing, aboriginal peoples and others. They have their corresponding data analysis with a journalistic perspective, relevant sources consulted, stories with human value and data visualizations.   The articles based in databases created by Datos UNDAV 2020 students have journalistically relevant findings for Argentina, such as:    -Almost 3 out of every ten patients who need a transplant die before they can be included on a waiting list.     -In 2020, public financial aid for children of femicide victims was doubled.     -For the first time in history, more women than men preside over the committees of the National Senate.     -Only one out of every one hundred requests to carry arms is made by a woman.     -Most people with disabilities do not process their disability certificate due to ignorance of how to do the process and its advantages.    It also includes about <a href=""https://4eqsfccwf42hzajhhiescsl3ue--datosundav-com-ar.translate.goog/entrevistas/"">  30 in-depth interviews with data journalists from Latin America  . The interviews were conducted by students of the subject and are part of a research funded by the university to analyze and characterize data journalism in the region. Journalists from La Nación Data y Chequeado, from Argentina; as well as, from Ojo Público, from Peru; El Tiempo and Cuestión Pública, from Colombia, Sudestada, from Uruguay; Post Data Club, from Cuba; Serendipia, from Mexico, among many other data journalists from media across the region share their experiences, work, visions and perspectives on this practice, in invaluable material for students and anyone interested in data journalism in Latin America.   The Data Journalism subject  (Datos UNDAV) became over time one of the most valued by students. The result of this positive assessment is the growth in enrollment semester by semester and a   video  in which some students shared their appreciation of the subject to promote it in the rest of the students of the career:   <a href=""https://youtu.be/5uPm_1l1F4w"">https://youtu.be/5uPm_1l1F4w   (only in Spanish).   Despite having a national law on access to public information and some laws at the provincial level, in 2020, due to the pandemic, the legal deadlines for the delivery of information to citizens (and students, in this case) were suspended and that was an added difficulty.   Likewise, despite the existence of legal frameworks, a gap persists between the laws and their practice: the information is usually provided incomplete, with arbitrary omissions and in closed formats that make it difficult to handle, analyze and process.   Although they are difficulties, all the more in the case of students, they also represent challenges that they undertake with enthusiasm.        Note: each work has the signature of its respective authors, students of Digital Journalism from the National University of Avellaneda. I am the professor and researcher in charge of the subject and coordinating the work of the students and the correction, editing and qualification of the articles.     Note 2: It was impossible for me to upload the photo in the form, so I link it here: <a href=""https://datosundav.com.ar/wp-content/uploads/2020/06/periodismo-de-datos-undav.jpg"">https://datosundav.com.ar/wp-content/uploads/2020/06/periodismo-de-datos-undav.jpg   ",http://bit.ly/3tnhnxD,http://bit.ly/3roDC4j,http://bit.ly/2O6OvJV,http://bit.ly/3oOmRxX,http://bit.ly/2MNalS1,http://bit.ly/3aB1KKB,http://bit.ly/3aytFuA,http://bit.ly/39MQqM2,http://bit.ly/2YF1tAJ,http://bit.ly/2O6PpWP,,,,
United States,ProPublica,Big,ProPublica," With a team of more than 100 dedicated journalists, ProPublica covers a range of topics including government and politics, business, criminal justice, the environment, education, health care, immigration and technology. We focus on stories with the potential to<a href=""https://www.propublica.org/impact"" style=""text-decoration:none;""> spur real-world impact  . Among other positive changes, our reporting has contributed to the passage of new laws; reversals of harmful policies and practices; and accountability for leaders at local, state and national levels.   One thing core to the work we do is the belief that data journalism is a key way in which we can hold power to account and shine a light into dark places. In 2020, we published a range of stories and interactive pieces that do just that. "," The projects we’re presenting were some of our most ambitious: we uncovered the activities of a secret Chinese propaganda network, exposed landlords who were illegally attempting to evict tenants during the pandemic, published long-secret NYPD disciplinary files, showed how climate change will devastate parts of the country and much more.    These stories, graphics and databases run the gamut from pieces that hold governments accountable to those that probe systemic harms brought by private companies and even the Catholic church.    Among them are some of our most popular projects, racking up millions of readers and some impact: companies stopped filing evictions, New York City is considering new NYPD reforms and senators wrote to debt collectors like Capital One asking them to stop seizing workers’ paychecks. ",https://www.propublica.org/article/despite-federal-ban-landlords-are-still-moving-to-evict-people-during-the-pandemic,https://projects.propublica.org/covid-evictions/,https://projects.propublica.org/nypd-ccrb/,https://projects.propublica.org/graphics/covid-hospitals,https://projects.propublica.org/climate-migration/,https://www.propublica.org/article/new-research-shows-disproportionate-rate-of-coronavirus-deaths-in-polluted-areas,https://www.propublica.org/article/capital-one-and-other-debt-collectors-are-still-coming-for-millions-of-americans,https://www.propublica.org/article/how-china-built-a-twitter-propaganda-machine-then-let-it-loose-on-coronavirus,https://projects.propublica.org/credibly-accused/,https://projects.propublica.org/coronavirus/bailouts/,,,,
United States,McClatchy Washington Bureau,Small,Shirsho Dasgupta,"   I think my first proper encounter with data journalism was with the publication of the Panama Papers in 2016. Back then I had just started a Master’s degree in English and was still undecided between wanting to become a reporter or an academic. Eventually I settled on the former and while I wanted to work on investigations in general, it was in journalism school that I properly discovered my love for data reporting (I like to think I was always good at Math, so that wasn’t a mental block that I had to overcome), especially while working as a student-reporter for Crosstown LA, a hyperlocal data-driven news outlet based in the campus.       After graduating, I joined the McClatchy Washington Bureau where I work almost exclusively with one of McClatchy’s papers, the Miami Herald. I have worked on projects based on data sets as varied as cancer treatment billings, police shootings, hospital ownership and leaked information involving thousands of documents or emails. My work last year has involved covering the COVID crisis in Florida, especially its toll on the state’s prison system and nursing homes; the impact the Black Lives Matter protests had on policing protocols; uncovering the influence private prison giants Geo Group has on both Washington, DC and Tallahassee; a $4 billion cryptocurrency scheme spanning the Americas and Europe; and the alleged role of U.S. administration officials in an attempted coup in Venezuela.        As someone who’s been in the field of data journalism for roughly two years, I am of course indebted to my professors and mentors at the journalism school of the University of Southern California. I’m also very grateful that my editors and colleagues trusted a 26-year-old newcomer to the field with important investigations.    I personally view data as not just numbers but more broadly as “information” ⁠— a dump of emails has the same value for me as a spreadsheet with loads of numbers. I think in this sense, it is important for data reporters to also learn and become adept at using research tools like LexisAdvance, PACER, the various OSINT tools available online. I also think ⁠— and this is something I try to do with the stories I work on as well ⁠— that it is very important to have a good narrative and human voices to support the data analysis. Corruption, violence or governmental failures is not just a matter of numbers ⁠— they leave behind victims and at the end of the day it is their story that we as journalists are trying to tell.       I also try to inform myself and unlearn prior assumptions and misconceptions about societal issues as much as possible. The information that a data reporter works with is not generated in vacuums and it is very important to be aware of how factors like gender, race, caste, class, sexuality or even nationality work and influence our daily lives and the events around us.       In my opinion, newsrooms in general should do as much as they can to promote some amount of data literacy among non-data journalists as well. The COVID-19 pandemic, if anything, has shown how important it is for reporters from all beats to have some basic understanding of data. My advice for journalism students interested in data reporting would be to take at least one class in accounting, statistics or financial reporting.       Thank you for considering my portfolio for the Young Talent award.   ","   My portfolio is built upon the work I produced at the Washington bureau of McClatchy newspapers in 2020. As a data reporter in an investigative unit that closely works with the Miami Herald (one of McClatchy’s papers), I produce data-driven stories both by myself and in collaboration with others.      Like most journalists last year, I was tasked with covering the COVID pandemic in Florida. Data analysis-based stories that I reported and produced included articles on the <a href=""https://www.mcclatchydc.com/news/coronavirus/article241576496.html"">plight of the uninsured in the midst of a health crisis , the <a href=""https://www.mcclatchydc.com/news/coronavirus/article241691226.html"">fears and anxieties of the loved ones of those in the state’s prison system , the <a href=""https://www.mcclatchydc.com/news/investigations/article242338421.html"">enormous political influence wielded by a private prison contractor with the worst COVID-safety record  and how <a href=""https://www.mcclatchydc.com/news/coronavirus/article247430840.html"">COVID infections surged after Florida’s governor eased visitation restrictions . Besides interviewing sources and writing the narratives for these stories, I analyzed and created visualizations from data as varied as the number of people insured per county, prison inmate populations, demographics and budgets, federal and state lobbying records and campaign contributions, and nursing home infection rates.       A few weeks after protests erupted across the United States after police officers killed George Floyd and Breonna Taylor, I created a survey, collected responses and produced a story on <a href=""https://www.mcclatchydc.com/news/investigations/article243980492.html"">how the protests had managed to change police use-of-force policies in many of the country’s biggest cities . I also worked with a colleague to report a story on the <a href=""https://www.mcclatchydc.com/news/nation-world/national/national-security/article243760662.html"">hundreds of surplus military-grade weapons and tactical gear that are handed out to local police departments by the U.S. Defense Department  and how the number of transferred weapons correlates to the number of people killed by officers of those departments.       Besides reporting investigative stories on a breaking news cycle, I also worked on enterprise projects. I sifted through a massive cache of emails, financial records and other documents found in a leak of data from a bank in the Cayman Islands and uncovered <a href=""https://www.mcclatchydc.com/news/investigations/article244763002.html"">how a Russian oligarch concealed from the IRS hundreds of millions in taxes . As one of the lead reporters in the Miami Herald/McClatchy collaboration with ICIJ and BuzzFeed News for the FinCEN Files, I scoured through the Suspicious Activity Reports and produced a story on <a href=""https://www.mcclatchydc.com/news/investigations/article245623470.html"">a $4 billion cryptocurrency Ponzi scheme spanning Florida, the British Virgin Islands and Europe . Later in 2020, I also went through 40 GB worth of text messages, photos, videos and documents and together with my colleagues reported a story on <a href=""https://www.mcclatchydc.com/news/investigations/article246819562.html"">the involvement of Trump administration officials in a failed coup attempt in Venezuela to depose Nicolás Maduro .       Combining data analysis, public records and testimonies from individuals, my stories on the Florida prison system and offshore shell companies shone some light into the workings of institutions that generally operate under a shroud of secrecy and opacity. The stories I reported on the workings of law enforcement brought fresh attention to the issue of transferring military-grade weapons to local police departments and also quantified something that is generally spoken of in abstract terms — the impact of protests on policy. Besides being published in the papers owned by the McClatchy chain, many of the stories were also later republished in other outlets and referred to in newsletters.       I believe my portfolio and the varied subjects I’ve covered in my reporting speaks to my skills as someone who is just about two years into their career.   ",https://www.mcclatchydc.com/news/coronavirus/article241576496.html,https://www.mcclatchydc.com/news/coronavirus/article241691226.html,https://www.mcclatchydc.com/news/investigations/article242338421.html,https://www.mcclatchydc.com/news/coronavirus/article247430840.html,https://www.mcclatchydc.com/news/nation-world/national/national-security/article243760662.html,https://www.mcclatchydc.com/news/investigations/article243980492.html,https://www.mcclatchydc.com/news/investigations/article244763002.html,https://www.mcclatchydc.com/news/investigations/article245623470.html,https://www.mcclatchydc.com/news/investigations/article246819562.html,,,,,
