Australia,Australian Broadcasting Corporation,Big,The Australian Broadcasting Corporation's Digital Story Innovations team," The ABC’s Digital Story Innovations team is a collection of journalists, developers, a designer and social media and video specialists. The team is focussed on data-driven, visual storytelling for Australian audiences.   Since its inception, we’ve used data to investigate and visualise stories on a broad range of issues from internment camps in remote China, devastating bushfires, how the Catholic school system takes from the poor to give to the rich and the wide reaching impact of climate change.    The DSI team’s 2020 portfolio showcases how data-driven techniques can be used across the full spectrum of story creation -- from discovery to research, analysis and presentation -- to either break new terrain or deepen public understanding of familiar topics.   The portfolio demonstrates how innovative storytelling techniques - such as data-driven investigation, graphics and interactive design - can be seamlessly blended with traditional person-centred storytelling to powerful effect.    It includes ground-breaking investigations based on leaked data (Catholic schools), exclusive access to tightly-held datasets (sexual assault, water theft), in-depth analyses of spatial datasets (the Arctic, water theft) as well as innovative use of publicly available datasets (coronavirus stories).   Each project demonstrates a commitment to rigorous, meaningful and transparent use of data while being unique in concept and execution. "," By combining innovative data mining, blending and analysis with compelling visual storytelling, our team is able to deliver investigative and explanatory journalism in a way that breaks down the complex nature of many of the topics.   Using water flow modelling data we revealed to our readers the disappearance of trillions of litres of water from Australia’s most vital network of rivers. We also analysed and visualised decades worth of water level data captured from both satellites and river gauges to show the devastating impact of drought on communities across Australia.   We were able to transport our audience to the remote environment of the Arctic Circle using spatial and climate data, to walk them through the effects climate change is having on the polar sea ice. A key goal was to ensure readers came away with a clear sense of why the stories were important and how they have been affected.   With “Rough justice”, the challenge was two-fold: first, obtaining multiple datasets from different police jurisdictions; and secondly, reconciling these disparate datasets to produce a coherent, accurate and meaningful national picture.   Our reporter negotiated for more than a year to obtain this exclusive data for every jurisdiction. In some instances, it involved informal collaboration with police commanders and police statisticians. In others, we were only able to obtain the requested data after applying pressure through backchannels. We then worked with two independent teams of experts to create a  framework for “mapping” dozens of police investigation outcomes across these crime classification systems.   “How the Catholic school system takes from the poor to give to the rich” combined leaked data from Catholic system insiders with finance figures scraped from the My School website. The My School dataset provides a more detailed picture of school income and expenditure than any publicly available data but is among the most tightly-held datasets in Australian education history.   Combining these datasets allowed us to calculate how the Catholic system’s secret funding formula impacted every school in the system. First, we extracted the secret funding formula by manually measuring the axes and data points in a series of scatterplots presented in the leaked documents. (The data used to create these scatterplots was not contained in the documents.) Next, we used the My School data to recreate the scatterplots as an interactive chart with “live data”. Lastly, we built a database to allow users to search for a school and individual results.   Our team has also led the ABC’s collection and analysis of domestic coronavirus statistics, maintaining a database that tracks key information about Australia’s fight against Covid-19.   Maintaining this database is not a straightforward exercise. The data is separately compiled and held by each of Australia’s eight state and territory health departments, plus the federal health department. Each uses its own definitions, protocols and processes. Combining this data into a national dataset that allows meaningful comparisons across the jurisdictions is a daily battle that requires forensic interrogation of multiple disparate datasets and  intimate understanding of the  methodology behind each one. To ensure the highest standards of data integrity we work closely with each of the nine health departments plus a network of researchers, physicians and public health experts.    With the data collection aspect being so labour intensive, we needed to streamline other parts of the reporting process. This led us to the idea of a semi-automated story, with “custom words” pulled from a central database maintained in Google sheets.    The story is constantly evolving, with visualisations and analysis added, expanded or removed as needed. It remains a vital resource for the public for up-to-date, accurate data about the pandemic. ",https://www.abc.net.au/news/2020-01-28/how-police-are-failing-survivors-of-sexual-assault/11871364?nw=0,https://www.abc.net.au/news/2020-05-04/charting-100-days-of-the-coronavirus-crisis-in-australia/12197884?nw=0,https://www.abc.net.au/news/2020-09-02/how-the-catholic-school-system-takes-from-the-poor/12588920?nw=0,https://www.abc.net.au/news/2020-09-03/the-mystery-of-the-murray-darlings-vanishing-flows/12612166?nw=0,https://www.abc.net.au/news/2020-12-16/arctic-sea-ice-dramatic-transformation-as-seen-by-satellites/12961584?nw=0,https://www.abc.net.au/news/2020-10-29/relentless-drought-captured-from-space/12753788?nw=0,https://www.abc.net.au/news/2020-03-17/coronavirus-cases-data-reveals-how-covid-19-spreads-in-australia/12060704?nw=0,https://www.abc.net.au/news/2021-01-25/covid-19-spread-through-australia-over-year/13078574?nw=0,https://www.abc.net.au/news/2020-05-21/road-to-recovery-from-the-covid-19-coronavirus-pandemic/12229514?nw=0,https://www.abc.net.au/news/2020-10-22/donald-trumps-campaign-email-blitz/12781782?nw=0,,,,
Finland,Helsingin Sanomat HS.fi,Big,Helsingin Sanomat HS.fi Data Desk Portfolio," Helsingin Sanomat has been pushing the envelope in Nordic digital journalism for years. The data desk team has been essential in turning around the previously ailing newspaper into a digital success, both journalistically and business-wise. The team collaborates with the rest of the editorial room on data and visual projects. The team features experts in software development, data journalism, robojournalism, and visual design. In 2020 the team was leading the way in Covid-19 reporting, for example in turning official data into easily accessible open data, but there was time also for other investigative and data projects.  "," These are short descriptions of the portfolio projects:    Covid-19 Tracking Project: Right from the beginning of the pandemic we started to collect Covid-19 data by hand to our database and also publish that data as open-source API for everyone to use. The project has had huge impact on two fronts: informing the public and in creating a new kind of open-source culture in journalism. Our stories have been read millions of times during the pandemic and the open-source API has been used not only by our competitors but by EU authorities as well.    Viime viikon kala: This investigative story looked into the quality of fresh fish that is being sold in the supermarkets. Lab tests showed that 25 % of the fish was not of good quality.    Missä he ovat nyt: In 2015 Finland saw over 30 000 asylum seekers coming to Finland. This story investigates what has happened to these people.     Naisten vuoro: We wanted to see how the role and share of women in Finnish film industry has changed during the years. The data investigation showed that in Finland women have never made as many movies as today.      Kaasukammio: A classic reportage from India about air pollution added with interactive data journalism. To get the context right the story offers a possibility to compare air quality in your nearest city to the one in Delhi.    Tiedämme ketä tapailet: The phone’s dating apps know almost everything about their user. We, together with an American news channel NBC News, compared which data each of them collects, looked where the data ends up and what that data can cause in the wrong hands.    Kuka hyötyy hitaksesta?: Helsinki city subsidizes some apartment buyers trough a housing price control system called Hitas. In this ground-breaking piece HS acquired and analysed multiple data sets and found out that almost 1 out of 5 apartments are most likely used against their intended purpose.    Kallis Helsiki, halpa maaseutu?:  Our story lets the reader explore how much it would cost for them to live somewhere than where they currently live. The story calculates exactly the amount of money they’d have at their disposal if they moved to another town or municipality in Finland.    Jatkot vain, ei seksiä: We reviewed all rape convictions of the Helsinki District Court for more than a year and a half. The verdicts paint a picture of men who rape a woman most often in their own or the victim’s apartment.  ",https://github.com/HS-Datadesk/koronavirus-avoindata,https://www.hs.fi/kotimaa/art-2000007691333.html,https://dynamic.hs.fi/a/2020/viimeviikonkala/,https://dynamic.hs.fi/2020/ne-30-000/,https://dynamic.hs.fi/a/2020/elokuvantekijat/,https://dynamic.hs.fi/2020/kaasukammio/,https://dynamic.hs.fi/2020/deittisovellukset/,https://dynamic.hs.fi/2020/hitas/,https://dynamic.hs.fi/2020/elinkustannukset/,https://dynamic.hs.fi/2020/hki-raiskaukset/,,,,
China,NetEase Datablog,Small,Netease DataBlog," Netease DataBlog is one of the pioneers in data journalism of China. It has been deeply engaged in the data journalism field for nine years which is considered as a media of great influence both in industry and academia. We commit to events sorting in logic and information mining in depth, presenting stories to audience in forms of infographics, H5, interactive charts and data maps by extensive auxiliary information.   Since the establishment of DataBlog, we have been actively working on stories about issues in social, economic, cultural, health, environmental, etc, for which we have received positive responses, including our follow-up stories on COVID-19.   DataBlog covers stories in all fields, and we could always present accurate interpretation from an appropriate and attractive perspective regardless of topic selections.   And for this very reason, data journalism is a niche in China though, the work of DataBlog could always achieve ideal communication effects. And now we are the column with the most followers among all peers in China. The amount of our audience is over 13 million.   Presently, our team consists of two editors and a designer. And we share a strong as well as impressive style no matter in content or in visualization. As a newsroom in small scale, now we applied for the 2nd Sigma Data Journalism Award. And We hope to learn from other workers in competition. "," Serises stories on COVID-19 is packaged into a portfolio for the competition.   Since the outbreak of the COVID-19, DataBlog acted instantly, and we are one of the earliest data journalism columns in China to cover revelant stories. In the early stage of the outbreak, the crowd knows little about coronavirus. By combing the epidemic data published by the government, we collected 129 confirmed cases of COVID-19 with complete or partial patient information including gender, age, infection symptoms and medicial state of the patients to partially present the basic picture of the epidemic to our audience as much as possible.   In addition, we made other tries. 33 days after the first case of COVID-19 was reported in Wuhan on December 31, 2019, the epidemic spreaded across the country. We decided to use SVG data map to inform readers the spread trajectory of the epidemic during the 33 days.   Besides, in another work of ours "" Cases Across   Four Generations  : How 527 Cluster Epidemics Spread "", we conducted statistics on the temporal and spatial span of the spread of cluster epidemics in China, the proportion of cases in three or four generations, the propagation algebra and more to warn the public of the necessity of not clustering during the epidemic period.   Except for COVID-19, medical resource is also within our concerns. At the beginning of the outbreak, we investigated on statistics about the use of beds and the change of bed occupancy rate in designated hospitals for treating COVID-19 confirmed and suspected patients in Wuhan, on the one hand; On the other hand, we have worked with a pressure meter for medical care in various cities in Hubei, calling for people to pay attention to the state of medical pressure in other cities in Hubei.   It is worth mentioning that we are getting more diversified in such exploration of topic selection about COVID-19. We not only focus on the coronavirus itself, but also pay more attention to how the people should live that affected by the COVID-19.   On January 23, 2020, Wuhan started lockdown for COVID-19. We found the Weibo hashtag ""Diary of the lockdown"" where plain people would record their dailylife and feelings. We analyzed the content of these diaries and restored the life of everyone with it after the lockdown.   Additionally, in "" Delivery Guy Tells   Secrets Behind the Lockdown in Wuhan "", we cooperated with the takeaway platform to peek into the living conditions of Wuhan people under the lockdown through takeaway orders, and found that the routine of people had alterd though, their taste remained. At the same time, we also found that many orders were sent to hospitals, many of which were from other address entrusting concern for people in Wuhan.   This is the introduction to the COVID-19 serises stories covered by DataBlog. We hope it will be of help for you to understand our work. ",https://t.1yb.co/gyKs,https://mp.weixin.qq.com/s/TdJzGdRwtAK65AAEMJ_M7A,https://mp.weixin.qq.com/s/jl1L_Rrk9vg4KkfGexxAmw,https://mp.weixin.qq.com/s/gOXAuqKFGq9o7l2nGoO3NA,https://mp.weixin.qq.com/s/JcYPLwvtN4bSaAjpahF5mg,https://mp.weixin.qq.com/s/4apnErDr4MTM1gtxkDsXTA,https://mp.weixin.qq.com/s/e7XhirHQOkAXvwBtY-7q6g,https://mp.weixin.qq.com/s/--2g7KFyAknFwEVQvc8sdg,,,,,,
Singapore,Reuters,Big,Reuters portfolio," Reuters tell their most important stories visually. Many pieces follow a narrative driven expressly by visual journalism, whether that is unique data gathering techniques, charting and data walk-throughs, satellite journalism, explainer illustrations or immersive presentations.     Regardless of subject matter, project size, or reporting methods, data journalism plays a major role in delivering stories.      Making data understandable   One of our missions is to make complex or difficult data sets easily digestible to tell stories.  Design is a key component of making difficult data accessible. For example, our project explaining the various strains of Covid-19, combines complicated subject matter and a granular database to clearly explain how the virus has evolved.     Public service   Getting timely information about the spread of the coronavirus and putting the mountain of statistics the pandemic generates in context for readers is at the core of public service journalism. Our COVID-19 Global Tracker leverages Reuters’ global reporting power to create one of the timeliest and in-depth coronavirus dashboards available. Readers can see global and regional trends, dig deep into their own country, or read the hundreds of headlines generated by our algorithm, fed by constantly changing data.   Another example is the “Shielded” series of data investigations, which show how an obscure legal doctrine called qualified immunity protects police accused of excessive force.     Innovative reporting techniques   The Reuters Graphics team are continuously thinking of ways to push the boundaries of reporting and gathering information. A number of striking examples of this are evident in our coverage of the Australia and California wildfires.     Innovative storytelling   The team are constantly experimenting with striking ways to deliver our stories too. Take our project on herd immunity for example. A custom-built model simulates the impact of social distancing measures and calculates herd immunity thresholds.     Strong emphasis on project design   Reuters pays careful consideration to the tone and subject matter as expressed through the design of the story.  Reuters strives to forge a visual connection between audience and content before they have read a single word.  The design and feel of each piece often reflects the tone and subject matter. This can be seen in across a range of our work.     Breaking news coverage   When major news breaks, such as natural or unexpected disasters, colleagues from all aspects of the newsroom join forces to work with the graphics desk. Data, deep reporting and powerful presentation create insightful explainers that give the reader everything they need to know about an event in one place.   Our job is to tell stories, and to further understanding of the news. We believe data, design, and narrative need to connect with the reader to bridge this. Reuters strives for this balance in every piece of visual journalism we undertake.     ","Stopping the spread Reuters built an epidemic model to simulate how the coronavirus can spread within a population. We ran the model thousands of times to compare when ""herd immunity"" would kick in for various reproductive numbers and under a range of scenarios. The model enabled us to show readers what level of immunity would likely be required in order to stop the spread. Anatomy of Singapore's outbreak Reuters transformed printed Covid-19 case data into a slick animation of Singapore's explosive worker dormitory clusters. The piece documents and explains how and where clusters formed. We used WebGL to enable the reader's computer and browser to seamlessly render more than 30,000 nodes. How the novel Coronavirus has evolved The coronavirus has mutated into several major groups, or strains. Mapping and understanding those changes is crucial to developing strategies to combat COVID-19. Reuters unraveled and analyzed over 185,000 genome samples to show how the dominance of strains has shifted over time. Reuters Global COVID-19 Tracker Getting timely information about the spread of the coronavirus and putting the mountain of statistics in context for readers is at the core of public service journalism. This tracker gives readers a key tool to filter down the firehose using custom algorithms to anticipate the headlines and mark milestones, progress and resurgence in a global and local context in five languages. Reuters independently collects infection and death data from each country, meaning our data is updated every few hours and often ahead of all other publications and dashboards. Australia's ecological disaster Australia's government called the bushfires crisis of 2020 ""an ecological disaster."" Reuters delivered the first data-driven analysis of fires and habitat data, showing how hundreds of species suffered. Air attack As some of the largest fires in California's history blazed in late summer, the California Department of Forestry and Fire Protection deployed a fleet of specially equipped firefighting aircraft. Reuters used a combination of flight data records, cartography, illustration to take an in-depth look at the types of aircraft and explain their specific roles. Patient 31 In February 2019, South Korea announced thousands of coronavirus cases in the space of only a few days, an outbreak that initially pushed their tally of cases higher than anywhere else outside of China. Reuters scraped daily press releases to build a data-driven account of the spread and emergence of patient 31, a single super spreader believed to be the source of thousands of infections. The piece went viral far outside Asia, with many on social media in the U.S. sharing it as an example of what can happen if social distancing isn't observed. Shielded Another example of strong public service journalism. This data investigation shows how an obscure legal doctrine called qualified immunity protects police accused of excessive force. This project was produced as police use of force was dominating U.S. headlines. Shifting smoke Reuters visualised and animated millions of atmospheric data points to show how smoke from U.S. wildfires travelled thousands of miles east, turning skies from New York to Washington D.C. hazy and reaching as far as Britain. How Joe Biden Democrat Joe Biden captured the U.S. presidency by expanding his party's appeal among suburban voters, in middle- and upper-income communities and in places where a large share of people graduated from college. On the Republican side, Trump made surprising gains among Latino populations in South Florida and in Texas along the border. We used a Python script to combine live county-level results with Census, Labor Dept. and other data sources for filtering, allowing us to look closely at these margins of victories so soon after the",https://graphics.reuters.com/HEALTH-CORONAVIRUS/HERD%20IMMUNITY%20(EXPLAINER)/gjnvwayydvw/,https://graphics.reuters.com/HEALTH-CORONAVIRUS/SINGAPORE-CLUSTERS/bdwpkdgngvm/,https://graphics.reuters.com/HEALTH-CORONAVIRUS/EVOLUTION/yxmpjqkdzvr/index.html,https://graphics.reuters.com/world-coronavirus-tracker-and-maps/,https://graphics.reuters.com/AUSTRALIA-BUSHFIRES-WILDLIFE/0100B5672VM/index.html,https://graphics.reuters.com/CALIFORNIA-WILDFIRE/AIRCRAFT/bdwpkzmyyvm/index.html,https://graphics.reuters.com/CHINA-HEALTH-SOUTHKOREA-CLUSTERS/0100B5G33SB/index.html,https://www.reuters.com/investigates/special-report/usa-police-immunity-scotus/,https://graphics.reuters.com/USA-WILDFIRE/POLLUTION/xlbpgjgervq/index.html,https://graphics.reuters.com/USA-ELECTION/RESULTS/jznvnjyjzvl/index.html,,,,
