Country,Publishing organisations,Organisation size,Project title,Cover letter,Description of your portfolio,Project link 1,Project link 2,Project link 3,Project link 4,Project link 5,Project link 6,Project link 7,Project link 8,Project link 9,Project link 10,,,,
Nigeria,"The Nation Newspaper, Nigeria",Big,Justina Asishana," I am Justina Asishana, I have been working as a Journalist for the past seven years. I am a graduate of the National Open University of Nigeria and began my Journalism career as a Staff with New Nigerian Newspaper before moving down to Daily Newswatch newspaper and after it went down, I began writing for The Nation Newspaper where I am currently employed.        In 2019, I recieved a training on Data and Investigative Journalism by the Premium Times Center for Investigative Journalism in Nigeria and in 2020, I recieved another training on Data and Solutions Journalism by the Pan Atlantic University in Nigeria. After these trainings, I have tried my best in infusing data and infographics into my reporting.        I  am inspired in infusing data and infographics into my reportage because it makes it easier for the people to understand and due to the limited reading span of an individual, I realize that they relate and understand the infographics more than straight reporting.        During this period, I was contacted by the African Women Journalism Project (AWJP) to write reports regarding COVID-19 and they encouraged the use of data and infographics, this made me embrace the fellowship and used a lot of infographics in my stories with the help of those in the project.        I have realized that although there is limited data in Nigeria but Journalists can either generate data on their own or use the available data and infuse it into their reportage, this, I think would make journalists embrace data journalism and not see it as too cumbersome. I am inspired to using and infusing data into my reportage because it is interesting and fun of making something complex into a simple process where the people in can understand.        I should be considered for this award because it would give me an opportunity to expand my network in data journalism and connect me with other experts who will take me through the new aspects of days journalism. It would also boost my zeal in writing more data oriented stories.        Lastly, it has been on my mind to improve the capacity of journalists who are my colleagues on Data journalism and how they can infuse data into their reportage.  "," In my portfolio, I have various data stories relating to health, finance and women issues; majority of the project was done with a focus on the impact of COVID-19.    In the virus pandemic story, it was difficult in getting data of women affected financially by COVID-19, while a lot of people were confessing to have lost their jobs, the only available data in Nigeria was by the National Bureau of Statistics and the data did not really focus on women. A data analyst in the Africa Women Journalism Project helped in drawing the visualization.    In the family planning story, ""baby boom looms in Niger"", I used data gotten from health centers I visited. I drew up the visualization myself, so also is the deforestation story.    The other story was done in collaboration with a data analyst who designed the visualization with the data I presented.  ",https://thenationonlineng.net/virus-pandemic-as-financial-tsunami-for-women/,https://thenationonlineng.net/covid-19-how-niger-govt-bridged-learning-gap/amp/,https://thenationonlineng.net/agricultural-processors-bemoan-covid-19-losses/,https://thenationonlineng.net/malnutrition-a-silent-pandemic-ravaging-children/,https://thenationonlineng.net/deforestation-worsens-climate-change-ii/,https://thenationonlineng.net/covid-19-baby-boom-looms-in-niger-state/,,,,,,,,
Spain,Mundo Deportivo,Small,"Ferran Morales, Mundo Deportivo","  I am Ferran Morales, I have been working at Mundo Deportivo for 21 years, currently we mainly do work for the web but we still maintain the commitment to make double pages of paper we continue to maintain, in this complicated 2020 where many competitions were not disputed it was very complicated, but thanks to the bet of the medium we were able to maintain and even exceed the quality of previous years. I am a very restless person and I always try to evolve year after year, I believe that the adaptation of new methodologies to carry out some online jobs (scrolltelling) will help us to do better jobs in the coming years.","The work presented are both digital and printed pieces of work published at El Mundo Deportivo.


Last year I built together with Angel Rigueira (the Tennis Editor at El Mundo Deportivo) a graphic about Rafa Nadal that got a finalist at the Sigma Awards. This year, our goal was to compare the Big Three (Rafa, Federer and Djokovic). 


We first built a printed version, double page (Big Three PDF), visualizing data from each tournament by player, with a closer deep dive on the number of points, Grand Slams, court surface and the classification from the ATP ranking. 


When doing the digital piece, we completely changed the point of view, including a scroll to highlight specific information. 


Leo Messi beat Pele's record as the player with the highest amount of goals scored with the same team. Together with Gabriel Sans (football editor), we gathered data from each goal: from where was this scored, its trajectory, season, journey, amongst other data. 


In order to adapt this to the online version, as we wanted to keep all the data, we had to gather these in a different manner, using the scroll again, so that we could highlight the most important facts or data. 



Lastly, I present the visualization done to celebrate the 700 goals scored by Leo Messi with th FC Barcelona and the Argentina selection. For this one, we filtered by competition and team that received the goal, amongst other data. The main image for this piece was the one about Messi with his thumbs pointing to the sky.

 

Tools used were Adobe Illustrator, Adobe Photoshop, Ai2Html, Java Script, HTML5, CSS3, Jquery and Google Spreadsheet. All data was gathered and saved in a Google spreadsheet. ",https://www.mundodeportivo.com/md/tenis/big-three/index.html,http://ferranmorales.com/interactivo/Big_Three.pdf,https://www.mundodeportivo.com/md/futbol/fc-barcelona/especial-record-todos-los-goles-de-messi-en-el-fc-barcelona/index.html,http://ferranmorales.com/interactivo/Messi_643.pdf,http://ferranmorales.com/interactivo/Messi_700.pdf,,,,,,,,,
India,"Mint, IndiaSpend, Medium, Soundcloud and Podcast websites for Podcast",Small,Rukmini S," I am an independent data journalist based in Chennai, India.   I have been a journalist since 2004, and for my first four years, I was a beat reporter with The Times of India, the world's most widely circulated newspaper, in Mumbai. I covered schools and colleges, courts and police stations, slums and high-rises, human rights abuses and resistances, and the government. As a rookie reporter, I was dispatched across the length and breadth of the city and its surroundings, and the experience was invaluable. What it did was to show mw how the levers of democracy actually work.   After taking up the Felix Scholarship to do an MSc in Development Studies at the School of Oriental and African Studies in London, I returned to India in 2009 and joined the Times Insight Group, a small team of data journalists, at The Times of India in Delhi. My work focused on politics, gender, inequality and crime. I travelled the length and breadth of the country in addition to my data work - on the trail of the first female candidates for electoral office in India's easternmost state, on the frontlines of village elections in India's westernmost state, in small local courtrooms, in farms and factories.   In 2013, I joined The Hindu, India's third largest English newspaper, as National Data Editor, the first Data Editor in an Indian newsroom. From 2013 to 2016, I led the organisation's data reporting through one keenly contested national election and several state elections, multiple budgets, Censuses, and other key moments. I carved a niche for myself as a journalist with the ground reporting abilities to procure exclusive data, and put it in proper context, as well as the data analytic abilities to draw new insights from the data, and the storytelling abilities to open new windows in the minds of readers. For a readership that was seeking to cut through rhetoric and partisan news reporting, this fresh data-driven approach was welcome, as our numbers began to show.   Two projects I did at The Hindu stood out. One, put data from India's religious Census in context, upturning the prevailing false narrative that fed Islamophbia. The other analysed cases of sexual assault to uncover the range of nuance that police statistics hid.   I left The Hindu after having my first baby in 2016 and later joined HuffPost India as Editor, Data & Innovation. After my second baby was born in 2017, I moved to working independently. I am now a columnist for Mint and IndiaSpend, and an occasional writer for a host of Indian and foreign publications, as well as the host of my own podcast. I believe I have established myself as one of India's foremost data journalists, and a compelling storyteller.   I won the Likho Awards for Excellence in Media in 2019 for data-driven reporting on changing attitudes to homosexuality. In 2020, I received an Honourable Mention for the Chameli Devi Jain Awards for an Outstanding Woman Journalist.   I believe that my body of work in 2020, a particularly challenging year for most and for me certainly, is something to be proud of. I was able to communicate both fact and uncertainty with a country full of questions, and tackle not just questions around health and reporting, but also the ripple effects on society and the economy. I would be honoured to be considered for the Sigma Awards 2021. ","I am an independent data journalist based in Chennai, India. I was the first Data Editor in an Indian newsroom when I was National Data Editor of The Hindu newspaper from 2013-2016, and my first ten years of journalism was exclusively for print (and allied digital) organisations. From 2016 to 2018, I was Editor (Data & Innovations) at HuffPost India, my first digital-only job. I have been an independent journalist since August 2018, and for me, 2020 was the year of exploring data journalism across media and formats. For the Indian media organisation India Today, I tracked covid numbers nearly daily to pick up trends in surges and declines early. I created original datasets using both publicly available data from Indian states and countries across the world, as well as data obtained through my reporting. My reporting identified early insights including on the possible impact on numbers of antigen testing in India, the emergence of high mortality hotspots in the Indian states of Maharashtra and Punjab that warranted closer monitoring, and states where numbers were unusually steady and lacked variation, meriting some scepticism. The articles were frequently the most widely read on India Today's website in , got the attention of the government, and were widely shared on social media. Officials charged with the pandemic response in Indian states contacted me for further insight from what I was seeing in the numbers to help tackle their outbreaks. For the Indian data journalism IndiaSpend, I wrote deeply researched and reported analytical pieces, often using data never accessed before, on the broader stories of the pandemic - addressing whether India was under-counting covid deaths and how it could fill in the blanks, trying to answer what could explain some of the mysteries of India's numbers, and interviewing experts and doctors from across the country. The articles were well received by the health and policy communities as well as from readers who were seeking proper context over enduring questions over Indian numbers. One reported story that showed how the pandemic had brought routine health services to a crash was brought up by MPs with the Indian government in Parliament. For the Indian newspaper Mint, I wrote data-driven pieces on the socio-economic impact and context of covid - what it meant for women in India's workforce, how India was in danger of missing disease and death among its most marginalised, how healthcare costs and the mode of accessing healthcare was important to understand covid. For international publications including The Guardian and South China Morning Post, I wrote analytical pieces using my insights from the data to explain the situation in the country and assess policy responses. The pieces helped ignite a conversation about whether the ""new normal"" was going to be more or less equal, and what India's existing struggles with state capacity and healthcare delivery meant for our covid response. Since March 2020, I also began a pandemic podcast, The Moving Curve, researched and recorded myself at home. I draw upon my data work and interviews with experts and those on the ground to break down news and insights from the pandemic for listeners who are looking for distillation and synthesis. I was floored by the reception to the podcast, and each new episode is met with praise for people looking for calm and unbiased data analysis and commentary. I am now over 108 episodes in, have built a loyal following, and won an Emergent Ventures Covid-19 India Prize for the podcast. Between them, these projects constitute my portfolio for 2020, and I am proud of my body of work in a challenging",medium.com/@rukminiwrites,https://www.indiaspend.com/covid-19-indian-exceptionalism-may-not-explain-low-mortality/,https://www.indiaspend.com/health/india-may-be-reversing-decades-of-progress-on-child-nutrition-new-govt-data-show-701363,https://www.indiaspend.com/why-audits-reconciled-death-data-are-still-missing-covid-deaths/,https://www.indiaspend.com/covid-19-disrupted-indias-routine-health-services/,https://www.indiaspend.com/do-we-really-know-why-covid-19-spikes-in-some-places/,https://www.livemint.com/news/india/india-s-poor-suffer-cough-and-cold-routinely-making-coronavirus-detection-difficult-11585544409496.html,https://www.livemint.com/news/india/why-india-migrants-walked-back-home-11590564390171.html,https://www.livemint.com/news/india/india-s-post-covid-recovery-in-employment-has-not-been-equal-for-men-and-women-11605509801472.html,https://www.livemint.com/news/india/your-caste-and-class-determines-how-you-spend-time-11602657834829.html,,,,
United Kingdom,"BBC, Local News Partnerships",Big,BBC Shared Data Unit," Dear judges,   I'd like to put forward for consideration the work of the BBC's Shared Data Unit (SDU) during 2020, a unique exercise in collaborative journalism.   During the pandemic, the team has explored and explained the implications of the pandemic to UK audiences through data.  We have brought dozens of datasets into the public domain through our open Github repository, along with accompanying methodology and code.   https://github.com/BBC-Data-Unit/shared-data-unit     Background    The SDU was set up to support the development of data journalism skills across the local news industry. This was in recognition of the growing importance of these skills in the face of more data being created and made available than ever before in all areas of public life, including local government.  It is a key initiative within the BBC and industry Local News Partnerships (LNP)     The unit delivers: a) The creation of large-scale data investigations in the form of data packs that LNP Partners can access and use to create stories of local interest and relevance b) Training courses for journalists that provide them with the necessary skills and experience to bring back to their home newsrooms.   The SDU aims to bring high quality investigative journalism to its local partner network and the BBC.  Its reporters take the time and space to work on exclusive investigative journalism, using cutting edge digital techniques to tell stories that would otherwise go untold.   One of the unique successes of the SDU has been to bring together journalists from media organisations to work on stories in collaboration.  Secondees bring fresh ideas to the SDU core team, who help work on those ideas and bring them to publication across our public network.     The stories have generated hundreds of local stories for more than 400 partner outlets.   The unit's output also generated content for network BBC programmes including the News Channel, Radio 2, BBC Radio 4 Today, Five Live, and the One, Six and Ten O'Clock news.  It has generated hundreds of news bulletins or leads across BBC local radio stations and regional television programmes.   In addition, the unit's output has been used by BBC Wales, BBC Scotland, Good Morning Ulster and the Sunday Politics show.   The move to home-working brought about by the pandemic necessitated a switch from in-house secondments to remote learning.   From September to October, 2020, the SDU ran a pilot with local news partners offering remote training sessions in four key areas.  Around 70 local journalists benefited from the sessions.    The sessions took delegates through the basics of spreadsheets including how to sort, filter and pivot data using the web-based free application Google Sheets.  The second session included more advanced techniques including how to merge datasets using the VLOOKUP function.  The Freedom of Information masterclass took delegates through how to maximise use of the Act when making requests to local authorities including what to do when your request is denied.  Delegates who took Using Statistics in Journalism learned how to perform descriptive statistics on datasets, as well as learning some of the common pitfalls journalists fall into when using statistics in their work.   Many thanks    Pete Sherlock "," The portfolio we are putting forward for consideration demonstrates how the SDU used data to help explain the implications of the pandemic to a national and regional audience.  We told exclusive stories by bringing inaccessible datasets into the public domain.   Our portfolio also demonstrates a commitment to transparency and open reporting.  All our datasets, code and methodology are published on our Github page and shared across the industry.     These stories made headlines across the BBC's flagship news programmes, as well as across hundreds of local newspapers and regional television and radio outlets.   In April, we reported how hundreds of thousands of key workers considered critical to the UK’s response to the coronavirus crisis were earning below the so-called “real living wage”.   Later that month, we reported experts warning some airports were ""at risk"" of closure because of the loss of business during the coronavirus pandemic.   In May, we reported on fears that the UK's scene would collapse without government support, as the lockdown left 140,000 performers, agents, promoters and technicians without a steady income since the end of March.   Later that month, we told how search interest in online casinos had hit an all-time high in the UK since lockdown began.   In June, the unit told how some of the largest UK councils may have to declare themselves effectively bankrupt unless the government agrees to further support.   In July, we reported how more than one in six young people are now claiming out-of-work benefits in some parts of the UK.   In August, we reported that flu vaccination rates among the most vulnerable were falling, revealing the scale of the challenge in expanding the vaccination programme.   We also reported how thousands of landlords were trying to avoid renting their properties to benefit claimants, despite a judge ruling a blanket ban was unlawful.   In October 2020, we reported police had wrongly cancelled records of serious crimes, in many cases without informing victims   In November, we reported experts' fears that thousands of smaller charities across the UK could cease to exist in the new year, following a shift in the nature of giving.   In December, we reported millions of people missed out on potentially life-saving scans when non-Covid-19 NHS services almost ground to a halt during the pandemic. ",https://www.bbc.co.uk/news/uk-53069772,https://www.bbc.co.uk/news/uk-england-52110652,https://www.bbc.co.uk/news/uk-england-52202974,https://www.bbc.co.uk/news/uk-england-52573685,https://www.bbc.co.uk/news/uk-england-52633355,https://www.bbc.co.uk/news/uk-53430775,https://www.bbc.co.uk/news/uk-53889184,https://www.bbc.co.uk/news/uk-53821317,https://www.bbc.co.uk/news/uk-54449321,https://www.bbc.co.uk/news/uk-55234280,,,,
United States,Vox,Small,Vox Covid-19 Data Coverage," To Whom It May Concern—   Wissam Rhayem, is a traveling emergency physician who splits his time between six hospitals in the southwest. Normally, it can take hours to transfer a patient from the small hospitals where he works in the western US to larger facilities with more resources. Now, even those are filling up with coronavirus patients.   Rhayem recently treated a 21-year-old who was on a cross-country family road trip when he got sick with COVID-19. “This kid ...” he trails off. “His heart stopped. We had gotten it pumping again, but he was paralyzed and intubated. I don’t think his Dad thought it was a real thing. I had to tell him that your son is probably not going to make it.”   As a journalist covering Covid-19, reporting on how the news impacts real people has never felt more important. But much of pandemic reporting has involved parsing data and finding visual ways to clearly and concisely communicate critical information. That's why I'm really proud of the Pulitzer-center supported collaboration that You You Zhou, a freelance data journalist, and I published this winter. The third piece in the series is You You Zhou's collaboration with Julia Belluz, a Vox staff writer.    As a freelancer, it's never been harder to place work: Many outlets' budgets have dried up, and quick-moving news cycles make working outside a newsroom even more challenging. That's another reason I'm submitting these pieces now. Despite the odds, they show a close attention to detail, and a commitment to using data to help convey complex topics in a comprehensible manner.   Many thanks in advance for your consideration!   Lois Parshley     "," The first of this series parses how mask use policies have impacted Covid-19 rates in various states. The second expands on that with original research conducted by online survey, finding where the general public was not adequately using masks. The third visually represents different states' approach to Covid-19 vaccinations. Together, they show a commitment to creatively using data to help make the pandemic more understable.  ",https://www.vox.com/science-and-health/21546014/mask-mandates-coronavirus-covid-19,https://www.vox.com/2020/12/15/21507630/pfizer-biontech-moderna-covid-19-vaccine-supply-states,https://www.vox.com/21534158/cdc-americans-masks-indoors,,,,,,,,,,,
